track_name,primary_artist_name,all_artists,album_name,track_popularity,artist_popularity,artist_followers,artist_genres,album_release_date,duration_readable,is_explicit,track_url,track_uri
Quarta Cadeira - Ao Vivo,Matheus & Kauan,Matheus & Kauan; Jorge & Mateus,Tem Moda Pra Tudo (Ao Vivo),75,80,13405486,sertanejo; sertanejo universitário; arrocha; agronejo,2019-03-22,3:44,False,https://open.spotify.com/track/5q0NlM6Pm8Pp3orq7zGiRn,spotify:track:5q0NlM6Pm8Pp3orq7zGiRn
Ela - Ao Vivo,Sorriso Maroto,Sorriso Maroto; Ferrugem,Sorriso Eu Gosto No Pagode - Parte 1 (Ao Vivo),75,78,3966518,pagode; samba,2023-09-14,3:16,False,https://open.spotify.com/track/1kWcd9h9HoeXsKaDVhSOtj,spotify:track:1kWcd9h9HoeXsKaDVhSOtj
Échame La Culpa,Luis Fonsi,Luis Fonsi; Demi Lovato,VIDA,75,78,11101544,latin,2019-02-01,2:53,False,https://open.spotify.com/track/0mlAOSILGRys2IbvyOT5VJ,spotify:track:0mlAOSILGRys2IbvyOT5VJ
Morena Jambo - Ao Vivo,Matheus Fernandes,Matheus Fernandes; Felipe Amorim,Morena Jambo / Miau (Ao Vivo),75,70,971331,piseiro; sertanejo; pagode; forró; arrocha,2025-11-27,2:38,True,https://open.spotify.com/track/5RJubPh66tvUWCBoJ1GwEY,spotify:track:5RJubPh66tvUWCBoJ1GwEY
Desbloqueado - Ao Vivo,Diego & Victor Hugo,Diego & Victor Hugo,Equilíbrio (Ao Vivo),75,77,4108199,sertanejo; sertanejo universitário; arrocha; agronejo; piseiro,2021-07-29,3:08,False,https://open.spotify.com/track/79Wou8NwYEFzTyDQudjENF,spotify:track:79Wou8NwYEFzTyDQudjENF
Carmed Chocolate,Pedro Paulo & Alex,Pedro Paulo & Alex; Diego & Victor Hugo,Carmed Chocolate,75,64,2410553,sertanejo; agronejo; sertanejo universitário; arrocha,2025-09-25,2:28,False,https://open.spotify.com/track/5q6p93gOrBy5dRkxOAylJ4,spotify:track:5q6p93gOrBy5dRkxOAylJ4
Opa Cadê Eu - Ao Vivo,Clayton & Romário,Clayton & Romário,Ao Vivo em Brasília (Vol.2),75,73,852384,sertanejo; sertanejo universitário; agronejo; arrocha,2025-02-06,2:34,False,https://open.spotify.com/track/3R8dmcSyROSR73XsdeSd7g,spotify:track:3R8dmcSyROSR73XsdeSd7g
Sexta Feira Hoje Tem,MC Ryan SP,MC Ryan SP; Mc IG; DJ Japa NK; Nilo; Boladin 211; MC LUUKY; Mc Negão Original,Sexta Feira Hoje Tem,74,87,8031441,brazilian funk; funk consciente; trap funk,2025-01-10,6:27,True,https://open.spotify.com/track/7jCgslBhuPF61B6yk90VYb,spotify:track:7jCgslBhuPF61B6yk90VYb
Romântico - Ao Vivo,Henrique & Juliano,Henrique & Juliano,Manifesto Musical 2 (Ao Vivo / Vol.1),74,87,31705085,sertanejo; sertanejo universitário; arrocha; agronejo,2024-12-13,3:03,False,https://open.spotify.com/track/708yXS1fLm1gAXFyIQxtX2,spotify:track:708yXS1fLm1gAXFyIQxtX2
Como É Que A Gente Fica - Ao Vivo,Henrique & Juliano,Henrique & Juliano,Novas Histórias (Ao Vivo),74,87,31705085,sertanejo; sertanejo universitário; arrocha; agronejo,2016-03-18,2:43,False,https://open.spotify.com/track/0zxWyvrKyz031tFfBnkYLr,spotify:track:0zxWyvrKyz031tFfBnkYLr
Meu Amor - Ao Vivo,Henrique & Juliano,Henrique & Juliano,O Céu Explica Tudo (Ao Vivo),74,87,31705085,sertanejo; sertanejo universitário; arrocha; agronejo,2017-07-07,2:54,False,https://open.spotify.com/track/3eHeTsX6W9iIEfn8l2xrWO,spotify:track:3eHeTsX6W9iIEfn8l2xrWO
Tarde Demais / Mágica / Oh! Chuva - Ao Vivo,Grupo Menos É Mais,Grupo Menos É Mais,MOLHO (Ao Vivo),74,86,6923314,pagode; samba,2025-10-16,4:26,False,https://open.spotify.com/track/4SHKz1SM7aikyK9WLAuN1J,spotify:track:4SHKz1SM7aikyK9WLAuN1J
Próximo Tchau,Gusttavo Lima,Gusttavo Lima,Feito À Mão Vol. 01,74,84,23751961,sertanejo; sertanejo universitário; arrocha; agronejo; piseiro; forró,2025-08-13,3:19,False,https://open.spotify.com/track/2MTPvC5feh2N2vZ7lo6IV1,spotify:track:2MTPvC5feh2N2vZ7lo6IV1
SENTA POCA (POSSO ATÉ NÃO TE DAR FLORES),Dj Luan Gomes,Dj Luan Gomes; DJ DAVI DOGDOG; DJ Japa NK; MC Meno K; Teko Bolado,SENTA POCA (POSSO ATÉ NÃO TE DAR FLORES),74,64,102237,brazilian funk; funk de bh,2025-10-20,1:36,True,https://open.spotify.com/track/4JYyktVuU06M2I8sTAVjAw,spotify:track:4JYyktVuU06M2I8sTAVjAw
Pra Sempre Com Você - Ao Vivo,Jorge & Mateus,Jorge & Mateus,Como. Sempre Feito. Nunca (Ao Vivo),74,83,24792451,sertanejo; sertanejo universitário; arrocha; agronejo,2016-02-19,3:27,False,https://open.spotify.com/track/2KGv51jgAz8OTjNPyRryfq,spotify:track:2KGv51jgAz8OTjNPyRryfq
Cantada Boba - Ao Vivo,Jorge & Mateus,Jorge & Mateus,Check-In (Ao Vivo),74,83,24792451,sertanejo; sertanejo universitário; arrocha; agronejo,2024-11-07,3:03,False,https://open.spotify.com/track/2gfn28JSINCJGLrUimmu0l,spotify:track:2gfn28JSINCJGLrUimmu0l
ESCADA DO PRÉDIO,PEDRO SAMPAIO,PEDRO SAMPAIO; Marina Sena,ASTRO,74,80,3246579,brazilian funk; funk pop; funk carioca; brazilian pop; brega funk,2024-09-04,2:17,True,https://open.spotify.com/track/4TnEIYOXZ9KBGHOIqG5Xs5,spotify:track:4TnEIYOXZ9KBGHOIqG5Xs5
Pirocada Quente,MC Jvila,MC Jvila; Mc Negão Original; DJ Dael; DJ Guh Mix,Pirocada Quente,74,77,358131,brazilian funk; trap funk; funk consciente,2025-01-28,3:15,True,https://open.spotify.com/track/2Z1DmmPWD3Lm0dWAxMfjxG,spotify:track:2Z1DmmPWD3Lm0dWAxMfjxG
Vai Cair Água - Ao Vivo,Diego & Arnaldo,Diego & Arnaldo; Zé Neto & Cristiano,RESENHA NATORA (Ao Vivo),74,69,1568926,sertanejo; sertanejo universitário; agronejo,2025-08-21,2:30,False,https://open.spotify.com/track/0qZwqMsGSClyrKzbVbRto9,spotify:track:0qZwqMsGSClyrKzbVbRto9
Largado Às Traças - Ao Vivo,Zé Neto & Cristiano,Zé Neto & Cristiano,Esquece o Mundo Lá Fora (Ao Vivo | Deluxe),74,80,23450864,sertanejo; sertanejo universitário; agronejo; arrocha,2018-07-13,3:54,False,https://open.spotify.com/track/371Up3WP7OqJNFPf0BiyUe,spotify:track:371Up3WP7OqJNFPf0BiyUe
Notificação Preferida - Ao Vivo,Zé Neto & Cristiano,Zé Neto & Cristiano,Esquece o Mundo Lá Fora (Ao Vivo | Deluxe),74,80,23450864,sertanejo; sertanejo universitário; agronejo; arrocha,2018-07-13,3:02,False,https://open.spotify.com/track/3tA0vALUwrzkTgHcm9j6oJ,spotify:track:3tA0vALUwrzkTgHcm9j6oJ
Vou Ter Que Superar - Ao Vivo,Matheus & Kauan,Matheus & Kauan; Marília Mendonça,Tem Moda Pra Tudo (Ao Vivo),74,80,13405486,sertanejo; sertanejo universitário; arrocha; agronejo,2019-03-22,3:09,False,https://open.spotify.com/track/6sRLrSetyIwIKhW1eMlUNP,spotify:track:6sRLrSetyIwIKhW1eMlUNP
TENTAR SER BREVE 🤷🏾‍♀️,KayBlack,KayBlack; Vulgo FK; Veigh; Murillo e LT no Beat; Fepache; Galdino; H4lfmeasures; Honaiser,FKAY,74,76,4377889,brazilian trap; trap funk; trap; brazilian hip hop,2025-11-25,3:43,False,https://open.spotify.com/track/5wTHqpJDnoGW562HQW1BmC,spotify:track:5wTHqpJDnoGW562HQW1BmC
Artista Genérico,Veigh,Veigh; Supernova Ent,Eu Venci o Mundo,74,79,6789613,brazilian trap; trap funk; trap; brazilian hip hop,2025-06-26,2:30,True,https://open.spotify.com/track/7yRlmQTjZ5pdtlq7ska9mj,spotify:track:7yRlmQTjZ5pdtlq7ska9mj
Última Noite,NATTAN,NATTAN; Léo Foguete,Estilo Nattanzinho (Ao Vivo em São Paulo),74,78,3963501,piseiro; forró; sertanejo; arrocha; brega; seresta,2024-08-07,2:37,True,https://open.spotify.com/track/6Ap9SM1WkmI4b4Mo2Cpa6f,spotify:track:6Ap9SM1WkmI4b4Mo2Cpa6f
Tô na Moda,Jennifer e Stephany,Jennifer e Stephany; CountryBeat,Tô na Moda,74,58,32861,agronejo; sertanejo; sertanejo universitário,2025-10-16,2:31,False,https://open.spotify.com/track/1BUcr5Z79eTuY5V9VIlXGD,spotify:track:1BUcr5Z79eTuY5V9VIlXGD
Caos De Alguém - Ao Vivo,Felipe e Rodrigo,Felipe e Rodrigo,Nossa Cara (Ao Vivo),74,76,612277,sertanejo; sertanejo universitário; agronejo,2025-08-29,2:34,False,https://open.spotify.com/track/6zxthXT7GUBX83vRmQiN3x,spotify:track:6zxthXT7GUBX83vRmQiN3x
Melhor Me Bloquear - Ao Vivo,Felipe e Rodrigo,Felipe e Rodrigo,Questão De Tempo (Ao Vivo),74,76,612277,sertanejo; sertanejo universitário; agronejo,2024-10-11,3:11,False,https://open.spotify.com/track/2ThEetsRrVOEoCNpoFVDjM,spotify:track:2ThEetsRrVOEoCNpoFVDjM
Nada Nada,Jmilton,Jmilton; Mc Jhey,Nada Nada,74,76,400735,phonk; brazilian phonk; funk,2025-06-13,1:29,True,https://open.spotify.com/track/75xD7ri6lKNL19Fno7nmKQ,spotify:track:75xD7ri6lKNL19Fno7nmKQ
Nos Bares da Cidade / Sem Direção - Ao Vivo,Panda,Panda; MJ Records,"Panda Sem Moderação, Vol. 1 (Ao Vivo)",73,85,442396,sertanejo; sertanejo universitário,2024-10-10,3:54,False,https://open.spotify.com/track/76qXdJtgMsCccgwbbLsy5v,spotify:track:76qXdJtgMsCccgwbbLsy5v
Comedinha Ficou Bravo,DJ Japa NK,DJ Japa NK; Mc Negão Original; MC Meno K,É o Japa Nk Né Bebê,73,84,551550,brazilian funk; trap funk; funk consciente,2024-12-05,2:32,True,https://open.spotify.com/track/06n87WQroP5WFD4aR45T8X,spotify:track:06n87WQroP5WFD4aR45T8X
Sei Que Tu Me Odeia,Anitta,Anitta; Mc Danny; HITMAKER,Ensaios Da Anitta,73,83,13305693,brazilian pop; funk pop; brazilian funk; funk carioca,2024-12-06,2:40,False,https://open.spotify.com/track/77HhVmRv7IxDqkyMxElSrK,spotify:track:77HhVmRv7IxDqkyMxElSrK
Os Anjos Cantam,Jorge & Mateus,Jorge & Mateus,Os Anjos Cantam,73,83,24792451,sertanejo; sertanejo universitário; arrocha; agronejo,2015-03-23,3:17,False,https://open.spotify.com/track/6ccKu0LwJzOhLAxBwP2PTk,spotify:track:6ccKu0LwJzOhLAxBwP2PTk
Ninguém Pode Saber,CountryBeat,CountryBeat; Ana Castela,Ninguém Pode Saber,73,76,317234,agronejo; sertanejo; sertanejo universitário,2025-10-22,2:34,False,https://open.spotify.com/track/5foViOTHRbErvRNf3VQ3rs,spotify:track:5foViOTHRbErvRNf3VQ3rs
Uma e Quinze da Manhã,Natanzinho Lima,Natanzinho Lima,De Bar em Bar 4.0,73,82,2408000,arrocha; seresta; forró; brega; piseiro; sertanejo,2024-03-06,2:44,False,https://open.spotify.com/track/7fdAc48FnW2P7LGuTMajcn,spotify:track:7fdAc48FnW2P7LGuTMajcn
Me Apaixonei Nessa Morena,Natanzinho Lima,Natanzinho Lima; Mc Tato; Gabb MC,Me Apaixonei Nessa Morena,73,82,2408000,arrocha; seresta; forró; brega; piseiro; sertanejo,2025-03-13,2:51,False,https://open.spotify.com/track/7xcDd2JxnJtO87QQr8uY0O,spotify:track:7xcDd2JxnJtO87QQr8uY0O
Oh Garota Eu Quero Você Só Pra Mim.,Oruam,Oruam; Zé Felipe; MC Tuto; Dj Lc da Roça; Mc Rodrigo do CN; MC K9; mc pl alves,Oh Garota Eu Quero Você Só Pra Mim.,73,77,4984774,trap funk; brazilian trap; trap; brazilian funk,2024-12-17,2:46,True,https://open.spotify.com/track/0BUkQGUXgcvf3gdCWYbtnJ,spotify:track:0BUkQGUXgcvf3gdCWYbtnJ
Meu Carro nao tem Porta Luva - Remastered 2024,DJ NATAN 22,DJ NATAN 22; Mc Rodrigo do CN,Meu Carro nao tem Porta Luva (Remastered 2024),73,56,27627,brazilian funk,2024-11-12,2:39,True,https://open.spotify.com/track/0vYrfm0eUQyi6fWbYnBiDc,spotify:track:0vYrfm0eUQyi6fWbYnBiDc
Veneno - Ao Vivo,Murilo Huff,Murilo Huff; Zé Neto & Cristiano,"Acústico, Vol.2 (Ao Vivo)",73,78,2682206,sertanejo; sertanejo universitário; arrocha; agronejo,2025-05-29,2:58,False,https://open.spotify.com/track/2QUl20UtEsH85livMYnbQr,spotify:track:2QUl20UtEsH85livMYnbQr
Barulho Do Foguete - Ao Vivo,Zé Neto & Cristiano,Zé Neto & Cristiano,"Escolhas, Vol. 2 (Ao Vivo)",73,80,23450864,sertanejo; sertanejo universitário; agronejo; arrocha,2023-06-22,2:13,False,https://open.spotify.com/track/42JNab8NPeCADJ9D3Cl5wS,spotify:track:42JNab8NPeCADJ9D3Cl5wS
Que Sorte A Nossa - Ao Vivo,Matheus & Kauan,Matheus & Kauan,Face A Face (Live),73,80,13405486,sertanejo; sertanejo universitário; arrocha; agronejo,2015-08-14,3:08,False,https://open.spotify.com/track/44pllb9f5QwcrD2kKc0gS0,spotify:track:44pllb9f5QwcrD2kKc0gS0
Cronômetro - Ao Vivo,Matheus & Kauan,Matheus & Kauan,Praiou (Ao Vivo / Vol.3),73,80,13405486,sertanejo; sertanejo universitário; arrocha; agronejo,2024-07-05,2:45,False,https://open.spotify.com/track/7pkpWcko6KEZANj0xKsCsu,spotify:track:7pkpWcko6KEZANj0xKsCsu
Barbie,MC Tuto,MC Tuto; DJ Glenner,Barbie,73,79,2537927,brazilian funk; funk consciente; trap funk,2024-10-18,3:12,False,https://open.spotify.com/track/6s1kzj4EbhFLXbuAGJbhbn,spotify:track:6s1kzj4EbhFLXbuAGJbhbn
Amor Traumatizado,Felipe Amorim,Felipe Amorim; Carol Biazin,RomantiDog (Deluxe),73,77,3415280,piseiro; forró; arrocha; sertanejo; agronejo; brega,2025-07-11,2:47,False,https://open.spotify.com/track/5dcOxj5o672WzZCc7OOUkX,spotify:track:5dcOxj5o672WzZCc7OOUkX
Pantera,MC Jvila,MC Jvila; G.A; Nagalli; Toledo; Honaiser,Pantera,73,77,358131,brazilian funk; trap funk; funk consciente,2025-09-10,3:11,False,https://open.spotify.com/track/6xgf2Nigvj0JuyNFFDAG7t,spotify:track:6xgf2Nigvj0JuyNFFDAG7t
AMOR BANDIDO,J. Eskine,J. Eskine; Alef Donk; Oruam,NEM SÓ DE MALUQUICE VIVE O HOMEM,73,68,577665,arrocha; piseiro; seresta; forró; brega,2025-06-27,3:14,True,https://open.spotify.com/track/73SqSkZt2yseVL513HyMgA,spotify:track:73SqSkZt2yseVL513HyMgA
O Alvo (feat. Henrique & Juliano) - Ao Vivo,Diego & Victor Hugo,Diego & Victor Hugo; Henrique & Juliano,Sem Contra-Indicação (Ao Vivo) [Deluxe],73,77,4108199,sertanejo; sertanejo universitário; arrocha; agronejo; piseiro,2018-07-13,2:44,False,https://open.spotify.com/track/4HQByPPgZOGbzvgJFZX61K,spotify:track:4HQByPPgZOGbzvgJFZX61K
Mentirosa - Ao Vivo,Hugo & Guilherme,Hugo & Guilherme; Wesley Safadão,Mentirosa (Ao Vivo),73,77,3493827,sertanejo; sertanejo universitário; agronejo; arrocha,2024-12-19,2:45,False,https://open.spotify.com/track/7pBPXkaVQaP3Y3Wwfkpvbn,spotify:track:7pBPXkaVQaP3Y3Wwfkpvbn
Gerente da Sicredi,Bruno & Barretto,Bruno & Barretto; CountryBeat,Gerente da Sicredi,73,65,2923263,sertanejo; agronejo; sertanejo universitário,2025-04-10,2:19,False,https://open.spotify.com/track/1daiWH5HMrDH9I8r3LIhqb,spotify:track:1daiWH5HMrDH9I8r3LIhqb
Lancinho - Ao Vivo,Turma do Pagode,Turma do Pagode,O Som das Multidões (Ao Vivo) [Deluxe],73,75,4060880,pagode; samba,2012-07-09,3:47,False,https://open.spotify.com/track/6CeeLpwJUYA4b0xL7eSvzn,spotify:track:6CeeLpwJUYA4b0xL7eSvzn
Predador de Perereca,BLOW RECORDS,BLOW RECORDS; Mc Jhey,Predador de Perereca,73,58,109676,,2025-07-05,3:06,True,https://open.spotify.com/track/6yDC6vwDgJ47HMhUFaQQ3v,spotify:track:6yDC6vwDgJ47HMhUFaQQ3v
Descer Pra BC,Brenno & Matheus,Brenno & Matheus; DJ Ari SL,Descer Pra BC,73,71,429898,agronejo; sertanejo; sertanejo universitário; piseiro,2024-11-15,2:46,False,https://open.spotify.com/track/6RzcNTnS02dnqoQMdTkQwi,spotify:track:6RzcNTnS02dnqoQMdTkQwi
365 Dias (Vida Mansa),MC Marks,MC Marks; MC Ryan SP; MC Jvila; MC Bruno MS; Mc Magal; Aaron Modesto; DJ Dael; MC LUUKY,365 Dias (Vida Mansa),72,74,2404414,funk consciente; brazilian funk; trap funk,2024-09-27,8:47,False,https://open.spotify.com/track/2drZGdAOxfE2KoMGTkidmq,spotify:track:2drZGdAOxfE2KoMGTkidmq
ACENDE UM ISQUEIRO,Lu & Rayane,Lu & Rayane; Panda,ACENDE UM ISQUEIRO,72,57,14745,sertanejo; sertanejo universitário,2025-09-12,2:35,False,https://open.spotify.com/track/1PJ1xV4UHTAOlwd1fC1NOG,spotify:track:1PJ1xV4UHTAOlwd1fC1NOG
Sequência da Botação,DJ Ryder,DJ Ryder; Dj Dudu Coupper; Mc Gw,Sequência da Botação,72,57,13177,agronejo; brazilian funk,2025-03-21,2:25,False,https://open.spotify.com/track/6XX6DTK8eugxgZqmlwcvkG,spotify:track:6XX6DTK8eugxgZqmlwcvkG
Teu Preferido,DJ BRIZY,DJ BRIZY; Mc Rodrigo do CN; FreesTyle Sounds,Teu Preferido,72,56,6991,brazilian funk,2025-05-16,2:16,True,https://open.spotify.com/track/58d1Gf3p4FWKNnGuq00wXT,spotify:track:58d1Gf3p4FWKNnGuq00wXT
A Danada Me Ligando,MC Cebezinho,MC Cebezinho; DJ Oreia; MC Tuto; Love Funk; Kako,A Danada Me Ligando,72,75,2012962,brazilian funk; funk consciente; trap funk,2024-08-23,4:43,True,https://open.spotify.com/track/3H7eBmcTJyuEMStfmKuLmG,spotify:track:3H7eBmcTJyuEMStfmKuLmG
Imagina esse Cenário,Matuê,Matuê; Veigh,333,72,81,14456391,brazilian trap; trap; brazilian hip hop; trap funk,2024-09-09,2:35,True,https://open.spotify.com/track/2fjqfFUq64thFsqfKN01kS,spotify:track:2fjqfFUq64thFsqfKN01kS
Champagne,Orochi,Orochi; PL Quest; BIN; Kizzy; Mainstreet,Lobo,72,77,9096757,brazilian trap; brazilian hip hop; trap funk; trap,2021-04-29,4:05,True,https://open.spotify.com/track/5XhG8HGyxLrkJAASxLA463,spotify:track:5XhG8HGyxLrkJAASxLA463
Agora / Um Sonho Louco / Não Posso Ter Medo de Amar - Ao Vivo,Panda,Panda; Ícaro e Gilmar; Fred & Fabrício,"Panda Sem Moderação, Vol. 1 (Ao Vivo)",71,85,442396,sertanejo; sertanejo universitário,2024-10-10,6:22,False,https://open.spotify.com/track/1QibZsBeNPlYjTyc2zmInb,spotify:track:1QibZsBeNPlYjTyc2zmInb
A Grama do Vizinho - Ao Vivo,Bruno Rosa,Bruno Rosa; Jorge & Mateus,"Evolução, Vol. 1 (Ao Vivo)",71,60,134456,sertanejo; sertanejo universitário,2025-06-26,3:00,False,https://open.spotify.com/track/4gBLQeJrre7DklMZIaPXPd,spotify:track:4gBLQeJrre7DklMZIaPXPd
Enquanto Houver Razões - Ao Vivo,Jorge & Mateus,Jorge & Mateus,A Hora É Agora (Ao Vivo Em Jurerê),71,83,24792451,sertanejo; sertanejo universitário; arrocha; agronejo,2012-10-15,3:11,False,https://open.spotify.com/track/5XrvlJDg5VDxf8ezkBjUKy,spotify:track:5XrvlJDg5VDxf8ezkBjUKy
3 Dias Virado,Mc IG,Mc IG,Só Explosão,71,82,12013282,brazilian funk; trap funk; funk consciente,2017-12-22,3:27,True,https://open.spotify.com/track/7DROtyR6IMNifyZmyksyE7,spotify:track:7DROtyR6IMNifyZmyksyE7
City Boys,Burna Boy,Burna Boy,I Told Them...,71,82,15149163,afrobeats; afrobeat; afropop; afroswing; dancehall; afropiano,2023-08-24,2:33,True,https://open.spotify.com/track/4RoKNqyZ9622tcAeNPNv5k,spotify:track:4RoKNqyZ9622tcAeNPNv5k
Coração Partido / Depois do Prazer / Cheia de Manias - Ao Vivo,Panda,Panda; Ícaro e Gilmar; Humberto & Ronaldo; MJ Records,Cê Tá Doido (Ribeirão Preto) [Ao Vivo],71,85,442396,sertanejo; sertanejo universitário,2025-06-03,6:38,False,https://open.spotify.com/track/5BOcmHCBRF3nlZR2BK32lY,spotify:track:5BOcmHCBRF3nlZR2BK32lY
SEQUÊNCIA CARAMELO,PEDRO SAMPAIO,PEDRO SAMPAIO; Mc Th; MC Nito,SEQUÊNCIAS #1,71,80,3246579,brazilian funk; funk pop; funk carioca; brazilian pop; brega funk,2025-11-18,1:43,True,https://open.spotify.com/track/4GHq9Xla9KO6SWo7a8uvNw,spotify:track:4GHq9Xla9KO6SWo7a8uvNw
Olha pra Cara de Quem Te...,MC LUUKY,MC LUUKY; MC Jvila; DJ Dael,Olha pra Cara de Quem Te...,71,80,1749225,brazilian funk; trap funk; funk consciente,2025-03-06,2:00,True,https://open.spotify.com/track/1VpOT1TfTivUmFjSGSRt1U,spotify:track:1VpOT1TfTivUmFjSGSRt1U
Me Amar Amanhã - Na Praia / Ao Vivo,Matheus & Kauan,Matheus & Kauan,Na Praia (Ao Vivo),71,80,13405486,sertanejo; sertanejo universitário; arrocha; agronejo,2016-02-26,2:46,False,https://open.spotify.com/track/0vXKKHxzwndf65d8E10oND,spotify:track:0vXKKHxzwndf65d8E10oND
Nessas Horas - Ao Vivo,Matheus & Kauan,Matheus & Kauan,Na Praia 2 (Ao Vivo),71,80,13405486,sertanejo; sertanejo universitário; arrocha; agronejo,2017-03-10,3:28,False,https://open.spotify.com/track/1MnUXXQEuzlJFNF5xMH1XQ,spotify:track:1MnUXXQEuzlJFNF5xMH1XQ
Amor No Escuro - Ao Vivo,Simone Mendes,Simone Mendes,Cantando Sua História 2 (Ao Vivo),71,79,3988625,sertanejo; sertanejo universitário; pagode; forró; piseiro,2025-12-11,2:54,False,https://open.spotify.com/track/091mho5ny7E3hAcZeXX24n,spotify:track:091mho5ny7E3hAcZeXX24n
Novo Balanço,Veigh,Veigh; Bvga Beatz; Prod Malax; Supernova Ent,Dos Prédios Deluxe,71,79,6789613,brazilian trap; trap funk; trap; brazilian hip hop,2023-05-19,2:20,True,https://open.spotify.com/track/4hKLzFvNwHF6dPosGT30ed,spotify:track:4hKLzFvNwHF6dPosGT30ed
Despacito - Remix,Luis Fonsi,Luis Fonsi; Daddy Yankee; Justin Bieber,VIDA,71,78,11101544,latin,2019-02-01,3:50,False,https://open.spotify.com/track/1vnnXMrBeEWiRg3YCMCjQq,spotify:track:1vnnXMrBeEWiRg3YCMCjQq
El Ultimo Adiós - Varios Artistas Version,Ricky Martin,Ricky Martin; Alejandro Sanz; Thalia; Juan Luis Guerra 4.40; Gloria Estefan; Celia Cruz; Olga Tañón; Ricardo Montaner; Ana Gabriel; Jorge Hernández; Los Tigres Del Norte; Alicia Villarreal; Alejandro Fernández; Carlos Vives; Jaci Velasquez; Marco Antonio Solís; José José; Lucía Méndez; Jennifer Lopez; Emmanuel,El Ultimo Adiós,71,75,8169456,latin pop; latin,2001-11-21,3:57,False,https://open.spotify.com/track/0tzixmHNQfE6S6SirSToxW,spotify:track:0tzixmHNQfE6S6SirSToxW
Medley Muído de Vaquejada - Desce do Cavalo / Balada do Vaqueiro / Monta Logo Vai / Calma / Senta No Fazendeiro / Deixa Ela Montar Na Minha Garupa / Botadão Do GW,Felipe Amorim,Felipe Amorim; Xand Avião; Zé Vaqueiro; Talita Mel; Mc Lekão,Medley Muído de Vaquejada - Desce do Cavalo / Balada do Vaqueiro / Monta Logo Vai / Calma / Senta No Fazendeiro / Deixa Ela Montar Na Minha Garupa / Botadão Do GW,71,77,3415280,piseiro; forró; arrocha; sertanejo; agronejo; brega,2025-08-20,6:02,True,https://open.spotify.com/track/7pzD7EudQxP4EhT5UeQjc7,spotify:track:7pzD7EudQxP4EhT5UeQjc7
Horas Iguais,WIU,WIU; Oruam,Horas Iguais,71,73,3651656,brazilian trap; trap; trap funk; brazilian hip hop,2022-10-05,4:06,False,https://open.spotify.com/track/4m8kG46clzxMxyrDuFo1Uq,spotify:track:4m8kG46clzxMxyrDuFo1Uq
Áudio - Ao Vivo em Brasília,Diego & Victor Hugo,Diego & Victor Hugo,Diego & Victor Hugo Ao Vivo em Brasília,71,77,4108199,sertanejo; sertanejo universitário; arrocha; agronejo; piseiro,2019-07-12,3:10,False,https://open.spotify.com/track/4v6SAnzwEr7s2m0gFQnJFJ,spotify:track:4v6SAnzwEr7s2m0gFQnJFJ
Gosta De Rua - Ao Vivo,Felipe e Rodrigo,Felipe e Rodrigo,Questão de Tempo (Ao Vivo / Parte 1),71,76,612277,sertanejo; sertanejo universitário; agronejo,2024-05-03,2:51,False,https://open.spotify.com/track/4VNRWHoiKHZJIoQHPbmJIv,spotify:track:4VNRWHoiKHZJIoQHPbmJIv
Castigo / Mil Anos - Ao Vivo,Panda,Panda; MJ Records,"Panda Sem Moderação, Vol. 1 (Ao Vivo)",70,85,442396,sertanejo; sertanejo universitário,2024-10-10,3:28,False,https://open.spotify.com/track/254Sv2uAWk5uwo0iJm5mIJ,spotify:track:254Sv2uAWk5uwo0iJm5mIJ
Frente a Frente / Só Pensando em Você - Ao Vivo,Panda,Panda; MJ Records,"Panda Sem Moderação, Vol. 1 (Ao Vivo)",70,85,442396,sertanejo; sertanejo universitário,2024-10-10,4:23,False,https://open.spotify.com/track/2VGeeK68iBt3pwmfjLizfz,spotify:track:2VGeeK68iBt3pwmfjLizfz
Chapa do Chatão,Mc Lele JP,Mc Lele JP; Mc IG; MC Ryan SP; DJ Hyago; MC LUUKY; MC Cebezinho,Chatão,70,83,1422008,brazilian funk; funk consciente; trap funk,2025-08-07,5:54,False,https://open.spotify.com/track/4naVjjeDSCcPj2RDbXBRku,spotify:track:4naVjjeDSCcPj2RDbXBRku
Saca da Twin,Mc Lele JP,Mc Lele JP; Dj GM; MC Tuto; Gudy,Saca da Twin,70,83,1422008,brazilian funk; funk consciente; trap funk,2025-02-28,3:58,False,https://open.spotify.com/track/6SCqMl5aQcHQnMspvyddNk,spotify:track:6SCqMl5aQcHQnMspvyddNk
Pilantra e Meio,Eric Land,Eric Land; Natanzinho Lima,Ao Vivo em São Paulo,70,65,1283140,piseiro; forró; arrocha; sertanejo; brega; seresta,2025-01-24,3:08,False,https://open.spotify.com/track/6h3EEYgtIuOjeqQPIC3H37,spotify:track:6h3EEYgtIuOjeqQPIC3H37
Feliz no Simples 🍀,Mc IG,Mc IG; MC Ryan SP; DJ Glenner; MC PH; DJ Hyago,Feliz no Simples 🍀,70,82,12013282,brazilian funk; trap funk; funk consciente,2025-05-13,3:53,False,https://open.spotify.com/track/11Pyzl3LTwpM9yVIDdwK68,spotify:track:11Pyzl3LTwpM9yVIDdwK68
Contagem Regressiva,Mc IG,Mc IG; Mc Negão Original; MC Ryan SP; MC Jvila; DJ Guh Mix; Mc Lele JP; Murillo e LT no Beat,Contagem Regressiva,70,82,12013282,brazilian funk; trap funk; funk consciente,2025-03-24,4:48,True,https://open.spotify.com/track/06VStvBWfFbepR97LhRo8D,spotify:track:06VStvBWfFbepR97LhRo8D
Let's Go 4,Dj GBR,Dj GBR; Mc IG; MC Ryan SP; MC PH; Mc Davi; Mc Luki; Mc Don Juan; Mc Kadu; TrapLaudo; MC GP; MC GH do 7,Let's Go 4,70,62,1440722,brazilian funk; trap funk,2023-08-29,10:41,True,https://open.spotify.com/track/2InS5VWKJQbsFBKOsf1cJB,spotify:track:2InS5VWKJQbsFBKOsf1cJB
Last Last,Burna Boy,Burna Boy,"Love, Damini",70,82,15149163,afrobeats; afrobeat; afropop; afroswing; dancehall; afropiano,2022-07-06,2:52,False,https://open.spotify.com/track/57DarSfRMIVRCeDBGW0l5S,spotify:track:57DarSfRMIVRCeDBGW0l5S
On the Low,Burna Boy,Burna Boy,African Giant,70,82,15149163,afrobeats; afrobeat; afropop; afroswing; dancehall; afropiano,2019-07-24,3:05,False,https://open.spotify.com/track/1zIk8RJEKGvoH4FioFnGyJ,spotify:track:1zIk8RJEKGvoH4FioFnGyJ
Amantes da Foda,Mc Rodrigo do CN,Mc Rodrigo do CN; DJ JOAO DA INESTAN,Amantes da Foda,70,81,336835,brazilian funk; funk de bh; funk carioca,2022-03-25,1:21,True,https://open.spotify.com/track/4DhDNNhIDdduS6nZMbSMbs,spotify:track:4DhDNNhIDdduS6nZMbSMbs
Reinventar / Guerra Fria - Ao Vivo,Panda,Panda; Ícaro e Gilmar; Humberto & Ronaldo; MJ Records,Cê Tá Doido (Santa Fé do Sul) [Ao Vivo],70,85,442396,sertanejo; sertanejo universitário,2025-06-03,4:33,False,https://open.spotify.com/track/1EX1mqUs9rm2CLXMV7ETjw,spotify:track:1EX1mqUs9rm2CLXMV7ETjw
Set Dj Gm 6.0,Dj GM,Dj GM; Mc Paiva ZS; Triz; MC Paulin da Capital; Mc Lipi; Mc Lele JP; MC Ryan SP; Gabb MC; Mc Daniel; MC Cebezinho; MC GH do 7; MC Marks; Mc Negão Original; GREGO,Set Dj Gm 6.0,70,71,872526,funk consciente; brazilian funk; trap funk,2023-12-22,10:24,False,https://open.spotify.com/track/4WXVqLSRHF4ypdiBngbcqU,spotify:track:4WXVqLSRHF4ypdiBngbcqU
Pulando o Muro - Ao Vivo,Zé Neto & Cristiano,Zé Neto & Cristiano,"Intenso, Vol. 3 (Ao Vivo)",70,80,23450864,sertanejo; sertanejo universitário; agronejo; arrocha,2024-08-29,2:32,False,https://open.spotify.com/track/0KDxhAvKeiVFL1bZccQVJs,spotify:track:0KDxhAvKeiVFL1bZccQVJs
Bebida Na Ferida - Ao Vivo,Zé Neto & Cristiano,Zé Neto & Cristiano,Esquece o Mundo Lá Fora (Ao Vivo | Deluxe),70,80,23450864,sertanejo; sertanejo universitário; agronejo; arrocha,2018-07-13,3:19,False,https://open.spotify.com/track/50YbE5MrvSu8Fz6A2dgTZ8,spotify:track:50YbE5MrvSu8Fz6A2dgTZ8
Decide Aí - Na Praia / Ao Vivo,Matheus & Kauan,Matheus & Kauan,Na Praia (Ao Vivo),70,80,13405486,sertanejo; sertanejo universitário; arrocha; agronejo,2016-02-26,2:42,False,https://open.spotify.com/track/2CKg2u26mtyRYodwbxmA8l,spotify:track:2CKg2u26mtyRYodwbxmA8l
Saudade Proibida - Ao Vivo,Simone Mendes,Simone Mendes,Cantando Sua História 2 (Ao Vivo),70,79,3988625,sertanejo; sertanejo universitário; pagode; forró; piseiro,2025-12-11,2:40,False,https://open.spotify.com/track/3lKOC96UdjCG47HZDJVyih,spotify:track:3lKOC96UdjCG47HZDJVyih
