track_name,primary_artist_name,all_artists,album_name,track_popularity,artist_popularity,artist_followers,artist_genres,album_release_date,duration_readable,is_explicit,track_url,track_uri
Erro Gostoso - Ao Vivo,Simone Mendes,Simone Mendes,Cintilante (Ao Vivo / Vol.2),70,79,3988625,sertanejo; sertanejo universitário; pagode; forró; piseiro,2023-10-20,2:58,False,https://open.spotify.com/track/6vq7r1Pqd3pyI07u63cPZV,spotify:track:6vq7r1Pqd3pyI07u63cPZV
Senta Poca,MC Meno K,MC Meno K; Kadu Martins; DJ Japa NK; DJ DAVI DOGDOG,Senta Poca,70,87,606411,brazilian funk; funk carioca; trap funk,2025-10-21,3:39,True,https://open.spotify.com/track/34qZBae134zVLUgZUeYHIc,spotify:track:34qZBae134zVLUgZUeYHIc
2025,MC Tuto,MC Tuto; DJ Oreia,2025,70,79,2537927,brazilian funk; funk consciente; trap funk,2024-12-16,2:52,False,https://open.spotify.com/track/0UGGLKM970ymsBBN5TKjsD,spotify:track:0UGGLKM970ymsBBN5TKjsD
Engana Dizendo Que Ama,Veigh,Veigh; Tz da Coronel; Toledo; Nagalli; Bvga Beatz; Supernova Ent,Dos Prédios Deluxe,70,79,6789613,brazilian trap; trap funk; trap; brazilian hip hop,2023-05-19,3:08,True,https://open.spotify.com/track/39xOREhViooEYFpmnKTdrl,spotify:track:39xOREhViooEYFpmnKTdrl
CONFISSÕES PT2,Nagalli,Nagalli; KayBlack; Veigh; Supernova Ent,MAGIC SHOW,70,72,510203,brazilian trap; trap; trap funk; brazilian hip hop,2024-04-25,2:25,True,https://open.spotify.com/track/0Q1ySdDoHDiotYn4nbMXNm,spotify:track:0Q1ySdDoHDiotYn4nbMXNm
No Me Doy Por Vencido,Luis Fonsi,Luis Fonsi,Palabras Del Silencio (Edición Aniversario - Un Año Despues),70,78,11101544,latin,2008,3:59,False,https://open.spotify.com/track/4lerOTNr2tFWJCAmmhymhi,spotify:track:4lerOTNr2tFWJCAmmhymhi
CAMBIARÉ,Luis Fonsi,Luis Fonsi; Feid,CAMBIARÉ,70,78,11101544,latin,2026-01-21,3:01,False,https://open.spotify.com/track/0DHkA97Q6SWz7uanmsCy8u,spotify:track:0DHkA97Q6SWz7uanmsCy8u
Mistérios,KayBlack,KayBlack; Murillo e LT no Beat,Mistérios,70,76,4377889,brazilian trap; trap funk; trap; brazilian hip hop,2024-07-16,2:16,False,https://open.spotify.com/track/1K14aw84e0i5IHFHkq7aNn,spotify:track:1K14aw84e0i5IHFHkq7aNn
Maturidade,KayBlack,KayBlack; Wall Hein; AMUSIK,Maturidade,70,76,4377889,brazilian trap; trap funk; trap; brazilian hip hop,2022-09-08,2:22,True,https://open.spotify.com/track/5RHOhXxMVhpEaBcG6hIydA,spotify:track:5RHOhXxMVhpEaBcG6hIydA
