name,uri,followers,genres,popularity,top_tracks
Henrique & Juliano,spotify:artist:3p7PcrEHaaKLJnPUGOtRlT,28536403,sertanejo; sertanejo universitário; arrocha; agronejo,89,Última Saudade - Ao Vivo; Amigo Da Minha Saudade - Ao Vivo; Saudade De Quem Eu Sou - Ao Vivo; Romântico - Ao Vivo; Seja Ex - Ao Vivo; De Trás Pra Frente - Ao Vivo; Aquela Pessoa - Ao Vivo; Xonei; Como É Que A Gente Fica - Ao Vivo; Meu Amor - Ao Vivo
Grupo Menos É Mais,spotify:artist:6vTqEFbTtTRJsuIpzZgjxi,5297407,pagode; samba,85,P do Pecado - Ao Vivo; Coração Partido (Corazón Partío) - Ao Vivo; Grau de Maluca - Ao Vivo; Aquele Lugar - Ao Vivo; Bebe e Vem Me Procurar / Quem Ama Sente Saudade (Ao Vivo); Nada Com Nada - Ao Vivo; Lapada Dela - Ao Vivo; Adorei; Vitamina C - Ao Vivo; Jejum de Amor / Caixa Postal / Vida Vazia - Ao Vivo
Jorge & Mateus,spotify:artist:1elUiq4X7pxej6FRlrEzjM,23338340,sertanejo; sertanejo universitário; arrocha; agronejo,84,"Cantada Boba - Ao Vivo; Xonei; Logo Eu; Tem Amor, Tem Volta - Ao Vivo; A Grama do Vizinho - Ao Vivo; Anti Amor - Ao Vivo; Marca Evidente; Haverá Sinais - Ao Vivo; Amo Noite E Dia - Live In Sao Paulo / 2010; Pra Sempre Com Você - Ao Vivo"
MC Ryan SP,spotify:artist:75i9GaW2MJUgt4BkdUnuUY,7297967,funk; funk consciente; brazilian funk; trap funk; brazilian trap,84,Ta Rico Os Menino Do Gueto 🍀; Sexta Feira Hoje Tem; Feliz no Simples 🍀; 365 Dias (Vida Mansa); Contagem Regressiva; Let's Go 4; Melhor Vibe; Toma Que Toma; Sereia; Set Dj Gm 6.0
Veigh,spotify:artist:4YqwRbMLqGHRHLS1w2ZKse,5944058,brazilian trap; trap; trap funk; brazilian hip hop,83,Artista Genérico; Talvez você precise de mim; Mônaco Freestyle; Taylor; Imagina esse Cenário; Ausência; Hiperfoco; Belieber; CONFISSÕES PT2; Engana Dizendo Que Ama
Zé Neto & Cristiano,spotify:artist:487N2T9nIPEHrlTZLL3SQs,22235068,sertanejo; sertanejo universitário; arrocha; agronejo,83,Escondendo o Ouro - Ao Vivo; Veneno - Ao Vivo; Resumindo - Ao Vivo; Notificação Preferida - Ao Vivo; Pulando o Muro - Ao Vivo; Largado Às Traças - Ao Vivo; Barulho Do Foguete - Ao Vivo; Deu Moral - Ao Vivo; Vai Cair Água - Ao Vivo; Amigo Taxista
Mc IG,spotify:artist:2q9wk5fkeU2C9CgCKdh4AN,10138121,funk; funk consciente; brazilian funk; trap funk,82,Ta Rico Os Menino Do Gueto 🍀; Sexta Feira Hoje Tem; Feliz no Simples 🍀; Contagem Regressiva; 400K; 3 Dias Virado; Let's Go 4; Não Vou Me Comprometer 🍀; Chapa do Chatão; Noite Fria
Supernova Ent,spotify:artist:3prRKGJz16RRMRSIM97nHw,237269,brazilian trap; trap; trap funk; brazilian hip hop,82,Artista Genérico; Talvez você precise de mim; Mônaco Freestyle; Taylor; Ausência; Hiperfoco; Belieber; CONFISSÕES PT2; Engana Dizendo Que Ama; Novo Balanço
Matheus & Kauan,spotify:artist:2Z0lRIqr997lIUiPtrpKCr,12503286,sertanejo; sertanejo universitário; arrocha; agronejo,81,Ilusão De Ótica - Ao Vivo; Cronômetro - Ao Vivo; Quarta Cadeira - Ao Vivo; Vou Ter Que Superar - Ao Vivo; Triplex - Ao Vivo; Nessas Horas - Ao Vivo; Que Sorte A Nossa - Ao Vivo; Decide Aí - Na Praia / Ao Vivo; A Chance É Grande - Ao Vivo; Carona - Ao Vivo
Ana Castela,spotify:artist:2CKOmarVWvWqkNWUatHCex,9145074,sertanejo; agronejo; sertanejo universitário; piseiro,81,Ilusão De Ótica - Ao Vivo; Olha Onde Eu Tô; Princesa - Ao Vivo; Rodeio no Texas 🐂; Peça Íntima; Sem Você; Foi Intenso - Ao Vivo; Canudinho - Ao Vivo; Fronteira - Ao Vivo; Nosso Quadro
Simone Mendes,spotify:artist:2eK9gcJQ6uqVvJL63dnOM3,3467060,sertanejo; sertanejo universitário; forró; piseiro; agronejo; arrocha,81,P do Pecado - Ao Vivo; Saudade Burra - Ao Vivo; Saudade Proibida - Ao Vivo; Me Ama Ou Me Larga - Ao Vivo; Erro Gostoso - Ao Vivo; Dois Tristes - Ao Vivo; Mulher Foda - Ao Vivo; Dois Fugitivos - Ao Vivo; Daqui pra Sempre; Oceano - Ao Vivo
Natanzinho Lima,spotify:artist:0Il5vC8lqunSFNav4mMLxU,1536324,arrocha; seresta; forró; brega; piseiro; sertanejo,80,Mentira Estampada; Pilantra e Meio; Uma e Quinze da Manhã; Me Apaixonei Nessa Morena; Logo Eu - Ao Vivo; Laranjinha; Pendências - Ao Vivo; Vagabundo Apaixonado; Me Apaixonei Nessa Morena - Ao Vivo; Bipolar
Diego & Victor Hugo,spotify:artist:3k68C6mNMJL6OaAdWeW2ZF,3615820,sertanejo; sertanejo universitário; arrocha; piseiro; agronejo,80,Tubarões - Ao Vivo; Entregador de Flor - Ao Vivo em Brasília; Dama do Baralho - Ao Vivo; Camisola e Fio - Ao Vivo; Desbloqueado - Ao Vivo; Áudio - Ao Vivo em Brasília; O Alvo (feat. Henrique & Juliano) - Ao Vivo; Facas - Ao Vivo; Criança Pequena - Família - Ao Vivo; Infarto
Mc Rodrigo do CN,spotify:artist:54bV1pHNm5h5EcEgMis1RC,263801,funk; funk de bh; brazilian funk; funk carioca,80,FAMOSINHA; Meu Carro nao tem Porta Luva - Remastered 2024; VAI NO CHÃO BANDIDA; Tipo Nino Abravanel; Oh Garota Eu Quero Você Só Pra Mim.; Cada Vez Mais Gostosa; Teu Preferido; Amantes da Foda; Macetada nas do Job; Medley Putaria 4.0: Socadão / Deixa Rolar / Golada No Jack / Braba No Chá
Mc Negão Original,spotify:artist:4LHTgACY32k94VDjenF0nP,990032,funk; brazilian funk; trap funk; funk consciente,79,Ta Rico Os Menino Do Gueto 🍀; Pirocada Quente; Medley de Igaratá 3; Comedinha Ficou Bravo; Medley de Igaratá 6; Vou pela Madrugada; Eu Até Gosto de Você; Boy Besta; Contagem Regressiva; Toma Que Toma
Wesley Safadão,spotify:artist:1AL2GKpmRrKXkYIcASuRFa,12122748,forró; sertanejo; piseiro; arrocha; sertanejo universitário; brega; seresta,79,"Mentira Estampada; Seis Cordas / Baião de Dois / Cavalo Lampião - Ao Vivo; Mentirosa - Ao Vivo; DNA do Mato; Quatro Semanas de Amor / Não Me Julgue / Do Meu Jeito - Ao Vivo; Laranjinha; Sede de Te Amar / Timidez - Ao Vivo; Bipolar; Diga Sim pra Mim; O Rei das Vaquejadas / Não Sou Vaqueiro / É o Boi, o Cavalo e o Vaqueiro / Cavaleiro Alado - Ao Vivo"
Ícaro e Gilmar,spotify:artist:6Wlvsn3IPHiZwAv02lB5eC,755696,sertanejo; sertanejo universitário; agronejo; sertanejo tradicional,79,Baqueado - Ao Vivo; 12 Horas / Pra Você Acreditar - Ao Vivo; Voltável - Ao Vivo; Tem Que Ser Você / O Que Combina Comigo É Você - Ao Vivo; Agora / Um Sonho Louco / Não Posso Ter Medo de Amar - Ao Vivo; Decida / Seu Amor Ainda É Tudo - Ao Vivo; Tudo Que Vai / Tempo Perdido - Ao Vivo; 24 Horas de Amor / Só Dá Você na Minha Vida / Pense em Mim / Talismã (Ao Vivo); Duas Vezes Você / Nova York - Ao Vivo; Sensível Demais / É Isso Aí - Ao Vivo
Hugo & Guilherme,spotify:artist:1LIuN7ov1IBQDdLsU83ojl,3024584,sertanejo; sertanejo universitário; agronejo; arrocha,79,Ama Um Maloqueiro; O Meu Coração Em Suas Mãos (Colgando en tu manos) - Ao Vivo; Foi Mal Deus - Ao Vivo; Mentirosa - Ao Vivo; Lembranças de Amor / Fogueira / Um Dia Te Levo Comigo - Ao Vivo; Vazou Na Braquiara - Ao Vivo; Morena De Goiânia - Ao Vivo; Mal Feito - Ao Vivo; Pula Fora - Ao Vivo; Meu Número - Ao Vivo
Lauana Prado,spotify:artist:6TYimByryGphZCtwYopH0y,5648991,sertanejo; sertanejo universitário,79,Saudade Burra - Ao Vivo; Camisola e Fio - Ao Vivo; Kamasutra - Ao Vivo; Haverá Sinais - Ao Vivo; Fetiche - Ao Vivo; Cobaia; Me Leva Pra Casa / Escrito Nas Estrelas / Saudade - Ao Vivo; Maluca - Ao Vivo; Whisky Vagabund0 - Ao Vivo; De Ex Pra Ex - Ao Vivo
Murilo Huff,spotify:artist:3hq7WoPJsrRP0KMSLhUgRz,2332231,sertanejo; sertanejo universitário; arrocha; agronejo,79,Veneno - Ao Vivo; Mulher Sem Ciúme - Ao Vivo; Dois Enganados; Me Ama Consciente - Ao Vivo; Já Vai Sabendo; Peça Íntima; Anestesiado - Ao Vivo; Camisa de Força - Ao Vivo; Me Caiu Tão Bem - Ao Vivo; Beijo de Outro Ângulo - Ao Vivo
Panda,spotify:artist:5qIpstBGrGteJZg1xIvbiz,116180,sertanejo; sertanejo universitário,79,Baqueado - Ao Vivo; 12 Horas / Pra Você Acreditar - Ao Vivo; Nos Bares da Cidade / Sem Direção - Ao Vivo; Tem Que Ser Você / O Que Combina Comigo É Você - Ao Vivo; Agora / Um Sonho Louco / Não Posso Ter Medo de Amar - Ao Vivo; Má Influência - Ao Vivo; Decida / Seu Amor Ainda É Tudo - Ao Vivo; Tudo Que Vai / Tempo Perdido - Ao Vivo; Nem Dormindo Consigo Te Esquecer / Mil Corações - Ao Vivo; Frente a Frente / Só Pensando em Você - Ao Vivo
MJ Records,spotify:artist:0oAZhL6hFrM3YRr6QzjlOf,22533,sertanejo; sertanejo universitário,78,Baqueado - Ao Vivo; Nos Bares da Cidade / Sem Direção - Ao Vivo; Má Influência - Ao Vivo; Nem Dormindo Consigo Te Esquecer / Mil Corações - Ao Vivo; Frente a Frente / Só Pensando em Você - Ao Vivo; Castigo / Mil Anos - Ao Vivo; Fica Comigo / Mensagem pra Ela - Ao Vivo; A Carta / É Amor Demais - Ao Vivo; Traz Ela de Volta pra Mim / Querendo Te Amar - Ao Vivo; Um Dia Te Levo Comigo / Do Brasil à Argentina - Ao Vivo
Sorriso Maroto,spotify:artist:1fUSLFr4WUBx7joEcGwpvG,3710099,pagode; samba,78,Apaguei Pra Todos - Ao Vivo; Ela - Ao Vivo; Pequenos Detalhes - Ao Vivo; Sinais - Ao Vivo; 80 Anos - Ao Vivo; Fica com Deus - Ao Vivo; Ainda Gosto de Você / Já Era - Ao Vivo; Quem Vai Ter Coragem - Ao Vivo; Como Nunca Amei Ninguém / Por Tão Pouco - Ao Vivo; Promessas - Ao Vivo
MC GP,spotify:artist:5s27i7oqhNWIcE4HeoVdq0,1965742,funk; funk consciente; brazilian funk; trap funk,78,300 no 7; Let's Go 4; Toma Que Toma; A Bebê Quer Oque; A Nata; Diz Aí Qual é o Plano?; Tenta Peitar; Nois não é Migo 2; Levada Mala; Cola No Ap
Ferrugem,spotify:artist:5ZfBThYiIIhL7jHMG8gDB2,6145773,pagode; samba,78,Apaguei Pra Todos - Ao Vivo; Apagar (Fundo Raso); Me Bloqueia (Ao Vivo); Duvido - Ao Vivo; Ela - Ao Vivo; Pra você acreditar - Ao vivo; Sinais - Ao Vivo; Eu não sou de me entregar; Pirata e tesouro - Ao vivo; Interessante
Luan Pereira,spotify:artist:5kVgcCdPbeUwxBqWxi2Ktl,3225282,agronejo; sertanejo; sertanejo universitário; piseiro,78,Vacilona - Ao Vivo; Saveiro; APOSTAR EM VOCÊ - Ao Vivo; NÃO ERA LOVE; Body Splash - Ao Vivo; Em Cima do Peão; Wi-Fi - Ao Vivo; UM PALMO - Ao Vivo; Dona Chica; FALTA DE QUÊ?
MC Meno K,spotify:artist:1CbQrKvCpEnekM3QMGJtXK,225635,funk; brazilian funk; funk carioca; brega funk,77,"FAMOSINHA; Comedinha Ficou Bravo; Destino (feat. Mc Negão Original); CAVALINHO; Bebê se tu passar no teste; THE BOX MEDLEY FUNK 4; Procedimento da Casa; SEQUÊNCIA COLOCADÃO; Vai Com Bundão; Senta, Senta"
Gustavo Mioto,spotify:artist:1X6ORK7IekgmyjV6IFPszP,7013346,sertanejo; sertanejo universitário; arrocha; agronejo,77,Princesa - Ao Vivo; Nada Com Nada - Ao Vivo; Anti Amor - Ao Vivo; A Chance É Grande - Ao Vivo; Cama Embrasa; Com Ou Sem Mim - Ao Vivo; Solteiro Não Trai - Ao Vivo; Contramão - Ao Vivo; Fronteira - Ao Vivo; Eu Fujo
Mc Livinho,spotify:artist:7me0S5Z40qVWj3gzyK8aC3,7918445,funk; brazilian funk; funk carioca,77,Vidrado Em Você; MTG NA IMAGINAÇÃO - TOPO SESSIONS VOL. 1; Rebolando; Na Imaginação; MTG PASSA PASSA PRA EU SARRAR; Fazer Falta; Hoje Eu Vou Parar Na Gaiola; Novidade na Área; Ela Vem; Amor É Mentira
Felipe Amorim,spotify:artist:3CIIaeZuFYrAD6PRVyuO4U,3030406,piseiro; forró; arrocha; sertanejo; agronejo; brega,77,Eu Vou na Sua Casa; Amor Traumatizado; Coisas Que Eu Sei; Love Gostosinho - Ao Vivo; Cama Embrasa; Vou Passar Gelinho; Medley Canoa - Putaria no Escuro / Menina do Job / Escada do Prédio / Mal Caminho / Pede Que eu Te Dou; Medley Putaria 4.0: Socadão / Deixa Rolar / Golada No Jack / Braba No Chá; Novinha do TKT; É Hit - Ao Vivo
Humberto & Ronaldo,spotify:artist:1zEo6Fk1iaaOYFlFPBHCFn,1854100,sertanejo; sertanejo universitário; arrocha,76,12 Horas / Pra Você Acreditar - Ao Vivo; Tem Que Ser Você / O Que Combina Comigo É Você - Ao Vivo; Decida / Seu Amor Ainda É Tudo - Ao Vivo; Romance - Ao Vivo; Tudo Que Vai / Tempo Perdido - Ao Vivo; Mtg Quero Te Encontrar; Duas Vezes Você / Nova York - Ao Vivo; Sensível Demais / É Isso Aí - Ao Vivo; Hoje Sonhei Com Você - Ao Vivo; Dois Loucos de Amor
DJ Japa NK,spotify:artist:1bpnl8qbR9GxmiNlkEufW6,200513,funk; brazilian funk; trap funk; funk consciente,76,Ta Rico Os Menino Do Gueto 🍀; Baile do Panta; Sexta Feira Hoje Tem; Medley de Igaratá 3; Comedinha Ficou Bravo; Vou pela Madrugada; Eu Até Gosto de Você; Te Levei Pro Beco; Nois não é Migo 2; Bbzão da Boca Inchada
Léo Foguete,spotify:artist:1DuBkL1pAgaZQHXKPiVr08,566954,forró; piseiro; sertanejo; arrocha; seresta; agronejo,75,Cópia Proibida; Última Noite - Solo; DONA - Ao Vivo; Última Noite; Quem de Nós Dois - Ao Vivo; Sem Você; Inconfiável; UM PALMO - Ao Vivo; Cabelo de Sol; É Hit - Ao Vivo
Felipe e Rodrigo,spotify:artist:7gZu6kPnY9enEi5FvgTO4F,470317,sertanejo; sertanejo universitário; agronejo,74,Caos De Alguém - Ao Vivo; Gosta De Rua - Ao Vivo; Melhor Me Bloquear - Ao Vivo; Pega O Beco - Ao Vivo; Oceano - Ao Vivo; Próximo Amor - Ao Vivo; Média Boa - Ao Vivo; Banquinho - Ao Vivo; Saudade Butequeira - Ao Vivo; Passo No Escuro - Ao Vivo
Guilherme & Benuto,spotify:artist:6m6e7D2TnV0aYMllFFwMxu,1922660,sertanejo; sertanejo universitário; agronejo; arrocha; piseiro,74,Grau de Maluca - Ao Vivo; Filho da Mãe - Ao Vivo; Manda um Oi - Ao Vivo; Haja Colírio (feat. Hugo & Guilherme) - Ao Vivo; Sujeito Homem - Ao Vivo; Torre Eiffel - Ao Vivo; Duas Três; Assunto Delicado - Ao Vivo; Jogado Na Rua / Casa Amarela - Ao Vivo; 3 Batidas - Ao Vivo
Xand Avião,spotify:artist:43DRDu6nLSeIedZ7T1A616,3313791,forró; piseiro; sertanejo; arrocha; sertanejo universitário; brega,74,"Melzinho; Matadinha De Saudade - Ao Vivo; Que Pancada de Mulher; Sede de Te Amar / Timidez - Ao Vivo; O Rei das Vaquejadas / Não Sou Vaqueiro / É o Boi, o Cavalo e o Vaqueiro / Cavaleiro Alado - Ao Vivo; Nunca Mais - Ao Vivo; Balanço da Rede; Assunto Delicado - Ao Vivo; Declaração / Amor Covarde / Me Da Um Beijo / Passei A Noite No Forró - Ao Vivo; Basta Você Me Ligar - Ao Vivo"
DJ Dozabri,spotify:artist:06e0gXtUpvgPUZFrR2ywsg,63383,funk; brazilian funk,74,Tipo Nino Vs Kabrinha; Fica De Quatão; Tipo Nino Abravanel; Hoje Vai Ter Conflito; Dentro do I30; Tipo Nino Vs Kabrinha - Ultra Slowed; Fica De Quatão - Super Slowed; Tipo Ruyter Ligando pra Nada; Pega Essa Chapada; Fica De Quatão - Extreme Slowed
Mc Davi,spotify:artist:1cYhx7ZOhYoVmnDPb9KMwo,4044811,funk; brazilian funk; funk consciente; trap funk,74,"Mãe Solteira; Let's Go 4; Desacato; Set do G15 - A Revoada Começou; Set dos Casados; Pra Inveja É Tchau; Irmã Gostosa; Bonita, Lindinha e Sagaz; Coração Gelado 2; EU VOU COM CARINHO ELA QUER COM FORÇA"
DJ Biel Divulga,spotify:artist:4nWyeZK6CbH0eAQ5tRWf9o,27338,funk; brazilian funk,73,Tipo Nino Vs Kabrinha; Fica De Quatão; Tipo Nino Vs Kabrinha - Ultra Slowed; Fica De Quatão - Super Slowed; Tipo Ruyter Ligando pra Nada; Pega Essa Chapada; Eliza Sanches; Fica De Quatão - Extreme Slowed; Tipo Nino Vs Kabrinha - Mega Slowed; Fica De Quatão - Ultra Slowed
Mc Lekão,spotify:artist:19yiaMgl4Z5TFhUNp7R1JJ,13640,funk; brazilian funk,73,Tipo Nino Vs Kabrinha; Fica De Quatão; Tipo Nino Vs Kabrinha - Ultra Slowed; Fica De Quatão - Super Slowed; Tipo Ruyter Ligando pra Nada; Pega Essa Chapada; Famoso Machuca Xota; Fica De Quatão - Extreme Slowed; Tipo Nino Vs Kabrinha - Mega Slowed; Fica De Quatão - Ultra Slowed
Clayton & Romário,spotify:artist:1tKrZaph4cLsnEdqC5BNEQ,638791,sertanejo; sertanejo universitário; agronejo; arrocha,73,Opa Cadê Eu - Ao Vivo; Desapaixona Eu - Ao Vivo; Aproveita - Ao Vivo; Sei Tocar Violão - Ao Vivo; Estrela Perdida / Fui Eu / Enquanto o Sol Brilhar - Acústico; Namorando Ou Não - Ao Vivo; Morena - Ao Vivo; Ai Eu Chorei - Ao Vivo; Água Nos Zói - Ao Vivo; Agenda Rabiscada / Amor Sincero / Fruto Especial - Ao Vivo
BIN,spotify:artist:1WXbiUMl1AT9Inb619xPUg,2179008,brazilian trap; brazilian hip hop; trap; trap funk,73,Eu Vou na Sua Casa; Champagne; Saturno; Poesia Acústica #12 Pra Sempre; Marília Mendonça; Apê 1001; Penelope; Quase uma Semana; Carro Forte; Dior
Israel & Rodolffo,spotify:artist:41QLxRXlc2NwfJZkHGHKid,3481385,sertanejo; sertanejo universitário; agronejo; piseiro; arrocha,73,"Não, Mas Quase - Ao Vivo; Arruma Um Bão; Marca Evidente - Ao Vivo; Fiu Fiu - Ao Vivo; Seu Brilho Sumiu - Ao Vivo; Bombonzinho - Ao Vivo; Greve De Beijo - Ao Vivo; Primeiramente - Ao Vivo; Batom de Cereja - Ao Vivo; Declaração pro Bar - Ao Vivo"
Danilo e Davi,spotify:artist:5DaqVKaxeqDbJuxaIP9m4u,210568,sertanejo; agronejo; sertanejo universitário,72,Apaga Apaga Apaga - Ao Vivo; Mudou O Texto; Dois Pé no Peito - Ao Vivo; Tarde Demais / Nova Namorada / Jejum De Amor - Ao Vivo; Tive Que Bater Palma - Ao Vivo; Fumo da Noite - Ao Vivo; Duvidoso; Digita e Apaga - Ao Vivo; Chorei No Uber; Tá Namorando Pra Quê? - Ao Vivo
Mc Jacaré,spotify:artist:6qrqAYlS6lUj2BVXax7SZW,910692,funk; brazilian funk; funk carioca; trap funk,72,Senta e Cala a Boca; Eu Até Gosto de Você; Senta e Cala a Boca; Pinxadão; Toma Tapa; Sentar pro Trem; Olhares; Vento Forte; Pelo Menos; Boca de Mel
Mc Pedrinho,spotify:artist:1etNnR2SdlelBQAICa2Q5m,4650685,funk; brazilian funk,72,"Encosta na Parede; Set do G15 - A Revoada Começou; DANÇARINA; Eu Vou Te Pegar; Se Prepara 2; Gol Bolinha, Gol Quadrado 2; Derrotas Pro Amor Ganhar (Ao Vivo); Patricinha; Bumbum Bate; Bipolar"
Dj LK da Escócia,spotify:artist:6WIjKbyqeO9MkfNMFJsF50,63066,funk carioca; brazilian funk; funk,71,Descer; Rebolando; Vai No Chão; Tubarão Te Amo; Bonde das Oncinhas; Viciado Em Ver Ela Descer (feat. MC Ryan SP); Vulgo Mc Paiva; Pras Novinha (feat. DJ Pedrin); Vem com a Tropa do Tubarão Tu Tu Tu Tu Tubarão; Vai pegar Nunca só em 2500
Kaique e Felipe,spotify:artist:0JRPF8WIKUtSO2IUYfrcuh,85490,sertanejo; agronejo; sertanejo universitário,71,Vacilona - Ao Vivo; Saveiro; Me Ama Consciente - Ao Vivo; Só Vivendo; Eu Quero Ser Grato; Do Final Pro Começo (Another Love) - Ao Vivo; Caindo a Ficha - Ao Vivo; Pega Sertanejo - Ao Vivo; Solteiro Iniciante; Subterrâneo - Ao Vivo
Matheus Fernandes,spotify:artist:37mqXU98U5GmH5ZDtlHM1c,907131,piseiro; sertanejo; pagode; forró; arrocha; sertanejo universitário,71,Grau de Maluca - Ao Vivo; Lapada Dela - Ao Vivo; Triplex - Ao Vivo; Balanço da Rede; Baby Me Atende - Ao Vivo; PROJETO ANOS 2000 (Sequência do Pente / Copo de Vinho / Ela Só Pensa em Beijar / Devagarinho); Altas Loucurinhas (Uni Duni Tê) - Ao Vivo; Casal De Solteiro - Ao Vivo; Coração Cachorro; Botada à Luz de Velas - Ao Vivo
Tropa da W&S,spotify:artist:1APqNiQUA2XpwLEbywSWmZ,22424,funk; brazilian funk; funk de bh,71,Encosta na Parede; Fui Mlk; MTG QUERO VER SE VOCÊ TEM ATITUDE; Baby Eu Tava na Rua da Água; Pode Me Bloquear; MTG DTMF; Ritmada Crazy; Princesinha; Ritmada do Flames; MTG Pode Me Bloquear
Dj Caio Vieira,spotify:artist:4Kv35Xnw1ODjO2nIHLhdBY,79014,funk de bh; funk; brazilian funk,71,FAMOSINHA; Aventura Com as Paty; De Baixo Pra Cima; Terminei Com A Ex; Conselho da Minha Ex; Faz 10K e Dorme; Mtg Quando a Noite Cai; Se Gostou de Mim Fé; OCASIÃO; Direto pra Base
DJ Ari SL,spotify:artist:3la3vRfIuDMsydpPfUBryR,31975,agronejo; sertanejo,70,Ama Um Maloqueiro; Descer Pra BC; Tantão; Agora Eu Pego; Agora Esquece; Mega Funk da Gauchada; NÓS TEM O DOM; Cavalgada Braba; Mega Funk Perigosa e Linda - Remix; Fuego da Roça
Malibu,spotify:artist:0PMk31f9Log4ixwUUY40p6,211437,pagode; brazilian pop,70,Eu Vou na Sua Casa; Cigana; Não Vai Embora; Penelope; Algoritmo Íntimo; Minha Arte; Pura Ilusão; Corda Bamba; Saudade de Falar de Amor; Só Quero Viajar
Vitão,spotify:artist:06lnOkY99sXVW44Y0M4BDP,902882,brazilian pop; brazilian hip hop,70,Eu Vou na Sua Casa; Poesia Acústica #7 Céu Azul; Penelope; Flores; Sei Lá; Café; Cobertor - Remix; Embrasa; Complicado; Te Liguei
DJ TOPO,spotify:artist:0xj9MJx9r0wO2o4aqdergP,249870,funk; brazilian funk,70,MTG NA IMAGINAÇÃO - TOPO SESSIONS VOL. 1; Na Imaginação; MTG QUEM NÃO QUER SOU EU; MTG PASSA PASSA PRA EU SARRAR; Medley Putaria 4.0: Socadão / Deixa Rolar / Golada No Jack / Braba No Chá; PEDRIN; Sem Chantagem; LADO MAU - TOPO SESSIONS VOL. 5; Comemoração; GOLADA NO JACK - TOPO SESSIONS VOL. 4
Kew,spotify:artist:2Ci1Tt7bCEU3OTByr1nc0y,50627,,70,Descer; Rebolando; Vai No Chão; Meu Jeito; Viciado Em Ver Ela Descer (feat. MC Ryan SP); LADO MAU - TOPO SESSIONS VOL. 5; Pensando em Mim; Feliz no Simples; Como Pode; Não Quer Love
MC G15,spotify:artist:3Nipsl6GVwwGyeAk0J29C6,3283919,funk; brazilian funk,70,Mãe Solteira; MTG QUEM NÃO QUER SOU EU; Set do G15 - A Revoada Começou; Set dos Casados; Cara Bacana; Ela Vem; Deu Onda; Só Você; Você Foi Diferente; EU VOU COM CARINHO ELA QUER COM FORÇA
DG e Batidão Stronda,spotify:artist:7gIeuq2qBfYhO1budb6TSQ,93536,piseiro; arrocha; forró,69,Mãe Solteira; Vou Passar Gelinho; Gata - Barbie; Malvadinho (Sei Que Ela é do Job); Mó Fita - DBMIX; A Distância Tá Maltratando; Fui Muleque; Preta do Cabelo Cacheado; Nós Tá Por Aí - Remix; Preta do Cabelo Cacheado
Rafa e Junior,spotify:artist:583d9476xT4d6A0pADiRJg,21156,agronejo; sertanejo; sertanejo universitário,69,"Ama Um Maloqueiro; Arrastadão; Só no Rolo; Querendo Me Namorar; Mais um Beijo - Remix; Mais um Beijo; Conspirou (Remix); Confusão - Na Bebura, Ao Vivo; Pra Que Foi Divulgar; Aqui é Ms - Up Session"
J. Eskine,spotify:artist:4gKSUeHW82tGBeJsJSB1JC,379775,arrocha; piseiro; seresta; forró; brega,68,Mãe Solteira; Resenha do Arrocha; Resenha de Ex-Love; AMOR BANDIDO; Tadala - Ao Vivo; Tem Culpa Eu; Cachaça E Mel; Resenha do Arrocha 3.0; Resenha do Arrocha 2.0; Costura - Ao Vivo
DU'L,spotify:artist:4bJqqUCbQmRxziUoxUz5mS,3116,trap funk; brazilian trap,67,Cê Deve Tá Linda; Nóis É Chefe 2; Sem Sentimento; Bloco das Sereias; Seu Job; Agora Você Lembra; Perigo; Cabriolet Nova; Tropa Dos Manda Chuva (feat. MC Negão Original & MC Dena); Cara Fechada
Mc Talibã,spotify:artist:2DMQ1LeygTDGeyErwBwaeG,128162,funk; brazilian funk; phonk,67,VAI NO CHÃO BANDIDA; MONTAGEM BRAVO - Slowed; Dentro do I30; Que Movimenta; MONTAGEM BRAVO; Um Sabadão Desse Uma Lua Dessa; MONTAGEM BRAVO - Super Slowed; Brincadeira Nova; Tipo Medina; Um Sabadão Desse Uma Lua Dessa - Sertanejo Remix
DJ DAVI DOGDOG,spotify:artist:5ffbqOCrcxCejQ7oqfWXm9,21850,funk; brazilian funk,66,Bbzão da Boca Inchada; Valentino; Toma Seu 5 Min de Fama; Ariano; Hoje É Papo de Festa; Seu Cupido Errou Bye Bye Bye; NOTA FALSA; Trajado de Tommy; Tigrinho Vai Soltar Carta; Musa Carioca
Talita Mel,spotify:artist:5wbSuC0q60AcyFwikoH8k3,28368,forró; piseiro; arrocha; sertanejo,66,Melzinho; Vestidinho; Teus Olhos; Jogo do Desprezo; Batom no Tom; Além do Pós; Sufoco; Talita Vida Louca; Faça Mal Feito; Fonte dos Desejos
Vitor e Luan,spotify:artist:5hDZAExrfOVqKBLS8Ofyac,190323,sertanejo; sertanejo universitário; piseiro; arrocha,66,Cara da Serenata - Live; Cara da Serenata; Meio Mundo de Coração - Ao Vivo Em Brasília; Localiza Aí BB; Eu e Eu; Sem Explicação - Ao Vivo; Lucidez - Ao Vivo Em Brasília; Sofridas por Minuto - Ao Vivo; Quem Ta Solteira - Ao Vivo; Birinight
Mc guizinho niazi,spotify:artist:6iUG0pMyifNBudO9B1s7cD,67598,funk; brazilian funk,65,Primeiro Beck Ela Me Mamou; Machuquei; Famosinha do Instagram; Japonesinha; Machuquei Machuquei X Ai Tá Machucando; TU VAI MAMAR (feat. MC Rafa 22 & MC Meno K); Only Fans; Machuquei; Tipo Medley; Quem É o Cara - O Cara É Muito Foda
Luccas & Rodrigo,spotify:artist:76FeGERn9sCv607gktNjQh,14814,sertanejo; agronejo,65,Cara da Serenata - Live; Cara da Serenata; Coração Manhoso - Live; Céu na Terra - Live; Antes da Briga - Live; Ilude Gostoso - Live; Tipo Férias - Live; Cama Que Ela Esquenta - Live; Par Perfeito; Contato Físico
Teko Bolado,spotify:artist:0hl7gXAUNmCr3cyhoE5Yga,17447,brega funk,65,Encosta na Parede; Sabotaram Meu Copo Arrochadeira; Sobe Morro Desce Morro; Penélope (Arrochadeira Remix); Socada Intensa; Eu Boto Ela Pede Soca; BOM E NOVO; Achei Que Era Pagode ( Remix Arrochadeira ); Com o Bundão - Arrochadeira; Te Uso e Jogo Fora
Rizzi Get Busy,spotify:artist:4VlgWkOGAvRh8Ke38UvqgO,2838,,65,Encosta na Parede; Tentei Ser Good Vibes; Era Só um Pesadelo; Que Situação; Doismilitantos; Cadeado; Open The Tcheka (PHONK REMIX); Rabetão - Phonk Remix; Filhas do Improvável; Tropa Das Brabas 2.0
DJ JHOW BEATS,spotify:artist:4CpxOMOqIfPQmEet9UnWhe,8441,funk; brazilian funk,64,Senta e Cala a Boca; Solo Paulista; FAZ 360 E SENTA; Epoca de Escola; Vai Ter Que Pagar Caro; Vai Malvada Vai Danada; Eu Fico Meio Sem Jeito; Prenderam o Bode; VAI TOMAR TOMANDO; Outro Planeta
SiarBeats,spotify:artist:5d2p2DbKrt26bBVeLcpTnr,3,,64,
Nickz Beatz,spotify:artist:3EwCyH36uCmBdntay44KAT,6,brega funk; brazilian trap,64,Black; Night Lights
Dj Guuh,spotify:artist:58SW6CcsQsZthOpEf0KASk,12493,funk; brazilian funk,61,VAI NO CHÃO BANDIDA; Phonk das Sombras; Automotivo Pode Vim; Automotivo Lunar; Só Cavalgada; Ela Botou o Gps; Meu Barbeiro Tira Onda; Phonk das Sombras - SLOWED; PISEIRO VAI NO CHÃO BANDIDA; AUTOMOTIVO TOMA CABEÇADA DENTRO
